{
  "id": "releases.json",
  "kind": "releases",
  "format": "releases/1.0",
  "provenance": {
    "release": "2026-01-05",
    "sources": ["example"],
    "licences": ["CC-BY-4.0"],
    "gbif_download_dois": ["10.0000/example"],
    "method": "test-1",
    "taxonomy": "test-taxonomy",
    "boundaries": "test-boundaries",
    "ranges": null,
    "protection": null,
    "code": "0.0.0",
    "run": "run-1"
  },
  "data": {
    "releases": [
      {
        "release": "2026-01-05",
        "status": "current",
        "published_at": "2026-01-05T06:00:00Z",
        "doi": null,
        "builds_on": null,
        "reason": null
      }
    ]
  }
}
